{
  "schema": "awf.adversarial-validation.v1",
  "run_id": "20260528-claudekit-advanced-mechanisms",
  "threats_considered": [
    "tests added after implementation instead of TDD",
    "hidden .agent scripts bypassing GitNexus impact analysis",
    "review gate accepting weak reviewer scores",
    "strict wiki lint passing despite broken links",
    "workflow docs continuing to load monolithic plans"
  ],
  "rationalization_checks": [
    {
      "excuse": "This is mostly workflow documentation, so tests can wait.",
      "rebuttal": "Workflow documentation controls executable agent policy, and the new scripts/checklist gates need regression tests first.",
      "outcome": "Focused Vitest tests were written and observed failing before implementation."
    },
    {
      "excuse": "GitNexus cannot index hidden .agent scripts, so impact analysis can be skipped.",
      "rebuttal": "Record UNKNOWN impact and manually identify direct workflow, CI, and hook consumers.",
      "outcome": "GitNexus index was refreshed, impact returned UNKNOWN for hidden scripts, and the risk gate records the direct consumers."
    }
  ],
  "results": [
    {
      "scenario": "Reviewer score is below 3",
      "outcome": "blocked_by_checklist_review_score_gate"
    },
    {
      "scenario": "Broken wiki link exists under strict lint",
      "outcome": "blocked_by_wiki_lint_strict_exit_code"
    },
    {
      "scenario": "Adversarial artifact omits rationalization checks",
      "outcome": "blocked_by_required_artifact_field"
    }
  ],
  "decision": "PASS"
}
